Q_ID,Quote text,C_ID,Chapter ,country_region,tag:harm,tag:operational_impact,tag:response_strategy,tag:governance
78,"“The false information and rumours ... greatly diminished our role as an organization. [Affected community members] started going to these [other] organizations asking where the aid was that had arrived [according to rumours], ‘Why didn’t we receive anything?’ ... people during that period did not see or analyse what this organization was for.”",69,CH6,Qatar,Psychological; Societal,Programme effectiveness and accountability,,
79,The National Society had to carefully balance its auxiliary role to the government in the humanitarian field. This situation has taught us to think more and consider the consequences of each word and action from different perspectives,82,CH7,Russia,,,Prebunking and narrative resilience,Regulation and public policy frameworks; Humanitarian principles and neutrality
80,"the focus was on identifying early signals of hesitancy and understanding psychological factors, such as confirmation bias, that make certain narratives more persuasive than others",34,CH3,Scotland,,,Rumour tracking and early warning,
81,Prebunking works best when rooted in real-time insights.,34,CH3,Scotland,,,Prebunking and narrative resilience,
82,"Harmful information is an omnipresent and often invisible threat – both online and offline. ... It can affect mental health, reduce motivation to continue humanitarian work and even increase vulnerability to conspiracy theories.",47,CH4,Slovakia,Psychological; Informational,,,
83,We collaborated with a Slovak expert in critical thinking to develop appropriate responses to common disinformation-related scenarios encountered by our staff and volunteers in the field,47,CH4,Slovakia,,,Partnership and coordination,
84,"the National Society formed a Crisis Communication Committee comprising the Secretary-General, Communications Manager, Safety and Field Coordinator, Partnerships Coordinator and representatives from the Emergency Operations Centre",48,CH4,South Sudan,,,Partnership and coordination,
85,"Recently, a commander of a militia group affiliated with the government wore a South Sudan Red Cross jacket bearing the National Society logo and in a recorded video described their operations in the Upper Nile region. The video went viral, generating strong reactions. ",48,CH4,South Sudan,Societal ,Programme effectiveness and accountability,,Humanitarian principles and neutrality
86,"In the emblem misuse case, the South Sudan Red Cross chose not to engage with the media, as the post had not attracted significant media attention. Instead, internal communication and partner engagement were prioritized to manage reputational risk and maintain trust proactively.",48,CH4,South Sudan,,Access constraints and acceptance risks; Programme effectiveness and accountability,Partnership and coordination,
87,"To counter harmful information more effectively, system-level strategies must prioritize local engagement, trust-building and cross-sector collaboration.",95,CH8,South Sudan,,,Partnership and coordination; Community engagement and accountability,
88,"Community members increasingly verified information before acting. For example, after receiving counter-messaging about a false attack, people chose not to flee, avoiding unnecessary displacement.",100,CH8,South Sudan,,,Information as aid; Debunking and corrective communication,
89,"Without larger-scale studies, it was difficult to isolate the specific impact of misinformation from other conflict drivers such as insecurity or displacement.",100,CH8,South Sudan,,,,
90,"While operational tools exist, there is no dedicated organizational policy on harmful information that includes a standard template and operating procedures across regions and scenarios.",101,CH8,South Sudan,,,Partnership and coordination,Regulation and public policy frameworks
91,"""Trust alone is not enough without a proper system for fast, verified communication, even trusted organizations risk failing their communities during disasters.”",69,CH6,Sri Lanka,,Programme effectiveness and accountability,,
92,"from Sudan to Ukraine, misinformation has obstructed safe passage of civilians, fuelled local suspicion toward aid workers and led to violent reprisals. These examples underscore that the costs of harmful information are not abstract – they are immediate and sometimes life-threatening. Waiting to react means being late to the race.",4,CH1,"Sudan, Ukraine",Social; Societal; Physical,Safety and security of staff and volunteers,,
93,"In Sudan, manipulated narratives about territorial control misled civilians into returning to contested areas or postponing evacuations, placing them in direct danger.",12,CH1,Sudan,Social,Distorted needs and demand signals ,,
94,"In Sudan, rumours targeting displaced groups led to exclusion from markets, housing and informal jobs. In some areas, entire labour sectors – such as butchery or tea vending – were destabilized as fear and suspicion drove down participation and income. These dynamics exacerbated existing inequality and fuelled intercommunal tensions.",12,CH1,Sudan,Deprivational/financial/economic; Social,,,
95,"When racism follows disaster, it disrupts collective mourning, isolates survivors and undermines long-term recovery. For diaspora and asylum-seeking communities, it reinforces a sense of unbelonging in the countries where they have sought refuge or migrated.",10,CH1,"Syria, Türkiye",Psychological; Social,,,
96,"In the monitored posts, local responders like the White Helmets attracted significantly more positive engagement than UN agencies, which were often criticized for perceived regime bias or bureaucratic distance. Community trust was strongly tied to transparency, visible impact and narrative ownership on social media.",30,CH3,Syria,,,,
97,"Despite this transparent, ethical and humanitarian-based system, misleading and false claims such as “donated blood is being sold” occasionally circulate online.",45,CH4,Türkiye,Societal; Informational,Access constraints and acceptance risks,,
98,Safeguarding public trust extends beyond the technical accuracy of information – it is the very foundation of a voluntary blood system and of humanitarian action.,45,CH4,Türkiye,,,,
99,"With support from the IFRC, the Uganda Red Cross Society leadership initiated a series of decisive reforms. Key staff positions were restructured and official statements were issued to clarify the situation and reassure both partners and the public.",81,CH7,Uganda,,,Debunking and corrective communication; Partnership and coordination,
100,"The crisis underscored how leadership-related reputational issues can quickly erode trust and how recovery requires transparency, structural reform and sustained commitment.",81,CH7,Uganda,Societal,Programme effectiveness and accountability,,
101,"“Culture plays a big role in shaping people’s ways of thinking and perception about information being passed to the community.""",69,CH6,Uganda,,,,
102,It became the first – and tragically successful – attack on the neutrality of humanitarian aid in Ukraine. “The picture changed everything on the ground”,80,CH7,Ukraine,Societal,,,Humanitarian principles and neutrality
103,"The hybrid war in the digital space forced the National Society to develop new communication competencies. Experts joined the team, a monitoring system was established to track public and social media discourse, and 24/7 readiness became the norm ",80,CH7,Ukraine,Digital/technological,,Rumour tracking and early warning,Technology governance and platform accountability
104,every information attack on neutral humanitarian aid has also created the opportunity to reach out and communicate humanitarian values. “Our biggest success is when fake news is not even shared anymore because people are already informed and know more”,80,CH7,Ukraine,,,Prebunking and narrative resilience; Debunking and corrective communication ,Humanitarian principles and neutrality
105,"As one migrant in the UK explained, “people are very confused … they are not getting the right information ... They do not know what to do or even where to go to get information …”",28,CH3,United Kingdom of Great Britain and Northern Ireland,Psychological; Informational,Distorted needs and demand signals,,
106,"Yet disinformation in the humanitarian space is growing. The UK is tackling this concerning trend directly – through our seat in key multilateral fora, our diplomatic channels and our UK-funded aid.",57,CH5,United Kingdom of Great Britain and Northern Ireland,,,Partnership and coordination; Community engagement and accountability,
107,"We also invest in research, such as a recent project with Grand Challenges Canada, which highlighted the importance of working with communities to build trust, enhance resilience and empower local leadership, and of identifying technological innovations that are scalable and adaptable.",57,CH5,United Kingdom of Great Britain and Northern Ireland,,,Community engagement and accountability,
108,"To combat confusion, the National Society issued a direct public rebuttal, using a simple social media graphic and a clear statement on its website to set the record straight – providing clarity without amplifying false narratives.",31,CH3,United States of America,,,Debunking and corrective communication,
109,"Like logistical planning before a storm, the National Society continues to monitor online trends and social mentions, address emerging misinformation, deploy proactive storytelling and provide internal guidance to employees and volunteers for awareness and alignment.",31,CH3,United States of America,,,Rumour tracking and early warning; Prebunking and narrative resilience,
110,"A persistent challenge has been the misinterpretation of emblems, particularly the Red Cross emblem. In some communities, the presence of this emblem on aid items and banners alongside the Yemen Red Crescent Society logo is misconstrued as a sign of religious affiliation among partners.",65,CH6,Yemen,Informational; Societal,Access constraints and acceptance risks,,Humanitarian principles and neutrality
111,At the heart of this success lies the principle of radical transparency.,65,CH6,Yemen,,Access constraints and acceptance risks,Prebunking and narrative resilience,
112,"“Trust within communities is a form of trust that is resilient ... built on shared cultural values, norms and understanding. At the same time, false information is particularly effective when it originates within the circle of people you trust ... the very ties that bind communities together can make them susceptible to misinformation.”",69,CH6,Zambia,Social,,,
113,"“The internet has revived and amplified ancient superstitions, spreading them rapidly and giving them new life.”",69,CH6,Zambia,,,,
114," in Zimbabwe, neutrality scores dropped sharply ... among the general population and ... among aid recipients. In such settings, the principle of neutrality risks being undermined by contested narratives and politicized messaging, threatening the very foundation of trust.",24,CH2,Zimbabwe,Societal,,,Humanitarian principles and neutrality